CREATE TABLE UST1(ID INT, T_NAME CHAR(10), COL1 INT, COL2 INT);
SUCCESS
CREATE TABLE UST2(ID INT, T_NAME CHAR(10), COL1 INT, COL2 INT);
SUCCESS
INSERT INTO UST1 VALUES (2, 'TW', 8, 3);
SUCCESS
INSERT INTO UST1 VALUES (2, '8M', 5, 4);
SUCCESS
INSERT INTO UST1 VALUES (7, '10NFRSZF27', 8, 2);
SUCCESS
INSERT INTO UST2 VALUES (2, 'TW', 8, 3);
SUCCESS
INSERT INTO UST2 VALUES (2, '8M', 5, 4);
SUCCESS
INSERT INTO UST2 VALUES (7, '10NFRSZF27', 8, 2);
SUCCESS

UPDATE UST1 SET T_NAME='JFWK', COL2=8 WHERE ID=2;
SUCCESS
SELECT * FROM UST1;
ID | T_NAME | COL1 | COL2
2 | JFWK | 8 | 8
2 | JFWK | 5 | 8
7 | 10NFRSZF27 | 8 | 2
UPDATE UST1 SET COL1=2, COL2=(SELECT UST2.COL2 FROM UST2 WHERE UST2.ID=1) WHERE ID=2;
SUCCESS
SELECT * FROM UST1;
ID | T_NAME | COL1 | COL2
2 | JFWK | 2 | NULL
2 | JFWK | 2 | NULL
7 | 10NFRSZF27 | 8 | 2
UPDATE UST1 SET COL1=2, COL2=(SELECT UST2.COL2 FROM UST2 WHERE UST2.COL2=UST1.COL2) WHERE ID=2;
SUCCESS
SELECT * FROM UST1;
ID | T_NAME | COL1 | COL2
2 | JFWK | 2 | NULL
2 | JFWK | 2 | NULL
7 | 10NFRSZF27 | 8 | 2
UPDATE UST2 SET COL1=(SELECT UST1.COL1 FROM UST1 WHERE UST1.ID=1),COL2=(SELECT UST1.COL2 FROM UST1 WHERE UST1.ID=4) WHERE ID=2;
FAILURE

UPDATE UST1 SET T_NAME='HJGEVHI', COL2=9 WHERE ID=7;
SUCCESS
