CREATE TABLE T_BASIC(ID INT, AGE INT, NAME CHAR, SCORE FLOAT);
SUCCESS
INSERT INTO T_BASIC VALUES(1,1, 'A', 1.0);
SUCCESS
INSERT INTO T_BASIC VALUES(2,2, 'B', 2.0);
SUCCESS
INSERT INTO T_BASIC VALUES(4,4, 'C', 3.0);
SUCCESS
INSERT INTO T_BASIC VALUES(3,3, 'D', 4.0);
SUCCESS
INSERT INTO T_BASIC VALUES(5,5, 'E', 5.5);
SUCCESS
INSERT INTO T_BASIC VALUES(6,6, 'F', 6.6);
SUCCESS
INSERT INTO T_BASIC VALUES(7,7, 'G', 7.7);
SUCCESS

CREATE TABLE T2(ID INT, AGE INT, NAME CHAR, SCORE FLOAT);
SUCCESS
INSERT INTO T2 VALUES(1,1, 'A', 1.0);
SUCCESS
INSERT INTO T2 VALUES(2,2, 'B', 2.0);
SUCCESS
INSERT INTO T2 VALUES(4,4, 'C', 3.0);
SUCCESS
INSERT INTO T2 VALUES(3,3, 'D', 4.0);
SUCCESS
INSERT INTO T2 VALUES(5,5, 'E', 5.5);
SUCCESS
INSERT INTO T2 VALUES(6,6, 'F', 6.6);
SUCCESS
INSERT INTO T2 VALUES(7,7, 'G', 7.7);
SUCCESS
INSERT INTO T2 VALUES(7,7, 'G', 7.7);
SUCCESS
INSERT INTO T2 VALUES(8,8, 'H', 8.8);
SUCCESS

CREATE VIEW CV1 AS SELECT * FROM T_BASIC;
SUCCESS
SELECT * FROM CV1;
ID | AGE | NAME | SCORE
1 | 1 | A | 1
2 | 2 | B | 2
4 | 4 | C | 3
3 | 3 | D | 4
5 | 5 | E | 5.5
6 | 6 | F | 6.6
7 | 7 | G | 7.7
INSERT INTO CV1 VALUES(8, 8, 'H', 8.8);
SUCCESS
SELECT * FROM T_BASIC;
ID | AGE | NAME | SCORE
1 | 1 | A | 1
2 | 2 | B | 2
4 | 4 | C | 3
3 | 3 | D | 4
5 | 5 | E | 5.5
6 | 6 | F | 6.6
7 | 7 | G | 7.7
8 | 8 | H | 8.8
SELECT * FROM CV1;
ID | AGE | NAME | SCORE
1 | 1 | A | 1
2 | 2 | B | 2
4 | 4 | C | 3
3 | 3 | D | 4
5 | 5 | E | 5.5
6 | 6 | F | 6.6
7 | 7 | G | 7.7
8 | 8 | H | 8.8

CREATE VIEW CV2 AS SELECT COUNT(ID) FROM T_BASIC;
SUCCESS
SELECT * FROM CV2;
COUNT(ID)
8
INSERT INTO CV2 VALUES(1);
FAILURE
INSERT INTO T_BASIC VALUES(8,8, 'H', 8.8);
SUCCESS
SELECT * FROM CV2;
COUNT(ID)
9

CREATE VIEW CV3 AS SELECT ID*2, AGE FROM T_BASIC;
SUCCESS
SELECT * FROM CV3;
ID*2 | AGE
2 | 1
4 | 2
8 | 4
6 | 3
10 | 5
12 | 6
14 | 7
16 | 8
16 | 8
INSERT INTO CV3 VALUES(12, 8);
FAILURE
INSERT INTO T_BASIC VALUES(9,9, 'J', 9.9);
SUCCESS
SELECT * FROM CV3;
ID*2 | AGE
2 | 1
4 | 2
8 | 4
6 | 3
10 | 5
12 | 6
14 | 7
16 | 8
16 | 8
18 | 9
UPDATE CV3 SET AGE=9 WHERE AGE=8;
SUCCESS
SELECT * FROM CV3;
ID*2 | AGE
2 | 1
4 | 2
8 | 4
6 | 3
10 | 5
12 | 6
14 | 7
16 | 9
16 | 9
18 | 9
SELECT * FROM T_BASIC;
ID | AGE | NAME | SCORE
1 | 1 | A | 1
2 | 2 | B | 2
4 | 4 | C | 3
3 | 3 | D | 4
5 | 5 | E | 5.5
6 | 6 | F | 6.6
7 | 7 | G | 7.7
8 | 9 | H | 8.8
8 | 9 | H | 8.8
9 | 9 | J | 9.9

CREATE VIEW CV4 AS SELECT ID, AGE FROM T_BASIC;
SUCCESS
SELECT * FROM CV4;
ID | AGE
1 | 1
2 | 2
4 | 4
3 | 3
5 | 5
6 | 6
7 | 7
8 | 9
8 | 9
9 | 9
INSERT INTO CV4 VALUES(10, 10);
SUCCESS
SELECT * FROM CV4;
ID | AGE
1 | 1
2 | 2
4 | 4
3 | 3
5 | 5
6 | 6
7 | 7
8 | 9
8 | 9
9 | 9
10 | 10
SELECT * FROM T_BASIC;
ID | AGE | NAME | SCORE
1 | 1 | A | 1
2 | 2 | B | 2
4 | 4 | C | 3
3 | 3 | D | 4
5 | 5 | E | 5.5
6 | 6 | F | 6.6
7 | 7 | G | 7.7
8 | 9 | H | 8.8
8 | 9 | H | 8.8
9 | 9 | J | 9.9
10 | 10 | NULL | NULL

CREATE VIEW CV5 AS SELECT ID, SCORE FROM T_BASIC;
SUCCESS
SELECT * FROM CV5;
ID | SCORE
1 | 1
2 | 2
4 | 3
3 | 4
5 | 5.5
6 | 6.6
7 | 7.7
8 | 8.8
8 | 8.8
9 | 9.9
10 | NULL
INSERT INTO CV5 VALUES(11, 11.11);
SUCCESS
SELECT * FROM CV5;
ID | SCORE
1 | 1
2 | 2
4 | 3
3 | 4
5 | 5.5
6 | 6.6
7 | 7.7
8 | 8.8
8 | 8.8
9 | 9.9
10 | NULL
11 | 11.11
SELECT * FROM T_BASIC;
ID | AGE | NAME | SCORE
1 | 1 | A | 1
2 | 2 | B | 2
4 | 4 | C | 3
3 | 3 | D | 4
5 | 5 | E | 5.5
6 | 6 | F | 6.6
7 | 7 | G | 7.7
8 | 9 | H | 8.8
8 | 9 | H | 8.8
9 | 9 | J | 9.9
10 | 10 | NULL | NULL
11 | NULL | NULL | 11.11

CREATE VIEW CV6 AS SELECT ID*2 AS ID2, AGE FROM T_BASIC;
SUCCESS
SELECT * FROM CV6;
ID2 | AGE
2 | 1
4 | 2
8 | 4
6 | 3
10 | 5
12 | 6
14 | 7
16 | 9
16 | 9
18 | 9
20 | 10
22 | NULL
SELECT ID2 FROM CV6;
ID2
2
4
8
6
10
12
14
16
16
18
20
22
UPDATE CV6 SET AGE=8 WHERE AGE=9;
SUCCESS
SELECT * FROM CV6;
ID2 | AGE
2 | 1
4 | 2
8 | 4
6 | 3
10 | 5
12 | 6
14 | 7
16 | 8
16 | 8
18 | 8
20 | 10
22 | NULL
SELECT * FROM T_BASIC;
ID | AGE | NAME | SCORE
1 | 1 | A | 1
2 | 2 | B | 2
4 | 4 | C | 3
3 | 3 | D | 4
5 | 5 | E | 5.5
6 | 6 | F | 6.6
7 | 7 | G | 7.7
8 | 8 | H | 8.8
8 | 8 | H | 8.8
9 | 8 | J | 9.9
10 | 10 | NULL | NULL
11 | NULL | NULL | 11.11
UPDATE CV6 SET ID2=8 WHERE AGE=8;
FAILURE
UPDATE CV6 SET AGE=AGE+1 WHERE AGE>8;
SUCCESS

CREATE VIEW CV7 AS SELECT T_BASIC.ID, T2.AGE FROM T_BASIC INNER JOIN T2 ON T_BASIC.ID = T2.ID;
SUCCESS
INSERT INTO CV7 VALUES(8,8);
SUCCESS

CREATE VIEW CV8(ID, AGE) AS SELECT ID, AGE FROM T_BASIC;
SUCCESS
CREATE VIEW CV9(ID_, AGE_) AS SELECT ID, AGE FROM T_BASIC;
SUCCESS

CREATE VIEW CVA AS SELECT ID, AGE, ID+AGE AS DAT FROM T_BASIC;
SUCCESS

CREATE VIEW CVB AS SELECT COUNT(T1.ID) AS NUM, SUM(T1.AGE)+SUM(T2.AGE) AS DATA FROM T_BASIC T1, T2 WHERE T1.ID=T2.ID;
SUCCESS
SELECT SUM(NUM) FROM CVB;
SUM(NUM)
11

CREATE VIEW CVC AS SELECT * FROM T_BASIC T1, T2 WHERE T1.ID=T2.ID;
SUCCESS
SELECT * FROM CVC;
ID | AGE | NAME | SCORE | ID | AGE | NAME | SCORE
1 | 1 | A | 1 | 1 | 1 | A | 1
2 | 2 | B | 2 | 2 | 2 | B | 2
4 | 4 | C | 3 | 4 | 4 | C | 3
3 | 3 | D | 4 | 3 | 3 | D | 4
5 | 5 | E | 5.5 | 5 | 5 | E | 5.5
6 | 6 | F | 6.6 | 6 | 6 | F | 6.6
7 | 7 | G | 7.7 | 7 | 7 | G | 7.7
7 | 7 | G | 7.7 | 7 | 7 | G | 7.7
8 | 8 | H | 8.8 | 8 | 8 | H | 8.8
8 | 8 | H | 8.8 | 8 | 8 | H | 8.8
8 | 8 | NULL | NULL | 8 | 8 | NULL | NULL

CREATE VIEW CVD AS SELECT * FROM T_BASIC T1, T_BASIC T2 WHERE T1.ID=T2.ID;
SUCCESS
SELECT * FROM CVD;
ID | AGE | NAME | SCORE | ID | AGE | NAME | SCORE
1 | 1 | A | 1 | 1 | 1 | A | 1
2 | 2 | B | 2 | 2 | 2 | B | 2
4 | 4 | C | 3 | 4 | 4 | C | 3
3 | 3 | D | 4 | 3 | 3 | D | 4
5 | 5 | E | 5.5 | 5 | 5 | E | 5.5
6 | 6 | F | 6.6 | 6 | 6 | F | 6.6
7 | 7 | G | 7.7 | 7 | 7 | G | 7.7
8 | 8 | H | 8.8 | 8 | 8 | H | 8.8
8 | 8 | H | 8.8 | 8 | 8 | H | 8.8
8 | 8 | H | 8.8 | 8 | 8 | H | 8.8
8 | 8 | H | 8.8 | 8 | 8 | H | 8.8
8 | 8 | H | 8.8 | 8 | 8 | H | 8.8
8 | 8 | H | 8.8 | 8 | 8 | H | 8.8
9 | 8 | J | 9.9 | 9 | 8 | J | 9.9
10 | 11 | NULL | NULL | 10 | 11 | NULL | NULL
11 | NULL | NULL | 11.11 | 11 | NULL | NULL | 11.11
8 | 8 | NULL | NULL | 8 | 8 | NULL | NULL
8 | 8 | NULL | NULL | 8 | 8 | NULL | NULL
8 | 8 | NULL | NULL | 8 | 8 | NULL | NULL
